Crime Type,Area,Date,Time,Severity,Crime Description,Victim Age,Police Station,Weather Condition,Time of Day,Incident Reported
Stalking,Vasant Kunj,2024-08-17,07:20:39,Medium,How employee turn would idea that data employee section another.,13,Vasant Kunj PS,Cloudy,Morning,Police
Assault,Greater Kailash,2024-01-23,03:27:01,Low,Walk let religious audience seven.,65,Greater Kailash PS,Clear,Afternoon,Citizen
Harassment,Karol Bagh,2023-07-09,07:16:26,Low,Nearly stage go sure include notice.,53,Karol Bagh PS,Foggy,Night,Citizen
Harassment,Khan Market,2024-03-06,23:23:15,Low,Kid heart girl and possible woman run.,59,Khan Market PS,Rainy,Morning,Citizen
Assault,Sarojini Nagar,2023-08-18,22:34:52,Medium,Number account eat sport deal professor.,11,Sarojini Nagar PS,Cloudy,Afternoon,CCTV
Assault,Mayur Vihar,2024-07-27,18:10:16,High,Employee we message build sister population.,11,Mayur Vihar PS,Clear,Morning,Citizen
Kidnapping,Pitampura,2025-01-06,22:43:43,High,Add former citizen particularly go.,48,Pitampura PS,Clear,Afternoon,CCTV
Burglary,Hauz Khas,2023-10-30,23:57:02,Low,In if remember throw design surface.,22,Hauz Khas PS,Clear,Morning,Citizen
Harassment,Paharganj,2024-02-12,13:21:14,High,Television ability reduce main.,34,Paharganj PS,Clear,Evening,Police
Burglary,Pitampura,2024-08-17,05:16:17,Medium,Change husband tend early write stand question follow national action.,59,Pitampura PS,Foggy,Afternoon,CCTV
Theft,Janakpuri,2024-10-13,19:28:32,Medium,Bill key loss myself recent high mean.,40,Janakpuri PS,Rainy,Evening,CCTV
Burglary,Hauz Khas,2024-06-22,16:20:33,Low,Book up throughout buy attack usually finally Mrs.,65,Hauz Khas PS,Clear,Morning,CCTV
Assault,Laxmi Nagar,2023-02-05,15:19:47,Low,Lawyer quickly animal place continue general particularly.,56,Laxmi Nagar PS,Clear,Morning,CCTV
Assault,Paharganj,2024-10-29,11:25:58,Low,Billion use society whole skin Mrs.,34,Paharganj PS,Rainy,Afternoon,Police
Burglary,Paharganj,2024-09-01,06:54:17,Medium,However force tell yourself rest miss alone some.,50,Paharganj PS,Cloudy,Afternoon,Citizen
Burglary,Janakpuri,2024-09-25,07:25:16,Medium,Production career leader job green Mr exactly word investment.,61,Janakpuri PS,Clear,Evening,CCTV
Theft,Karol Bagh,2024-03-24,23:21:00,Medium,Sound out reveal season culture car identify necessary design price.,64,Karol Bagh PS,Rainy,Night,CCTV
Kidnapping,Greater Kailash,2024-03-14,03:27:11,Low,Magazine training American suffer Mr miss citizen usually.,46,Greater Kailash PS,Rainy,Evening,Citizen
Kidnapping,Vasant Kunj,2024-05-01,23:21:44,Low,Hope knowledge last book house brother lot difference financial.,66,Vasant Kunj PS,Cloudy,Evening,Police
Assault,Rajouri Garden,2024-01-31,09:08:01,High,Billion million last political hand meeting.,25,Rajouri Garden PS,Rainy,Evening,Citizen
Burglary,Laxmi Nagar,2024-08-23,13:27:56,Low,Career various against yourself pattern doctor.,21,Laxmi Nagar PS,Clear,Evening,Police
Stalking,Greater Kailash,2024-04-12,06:15:09,Low,Hotel it similar interview guess article.,68,Greater Kailash PS,Clear,Afternoon,Police
Harassment,Saket,2023-08-18,09:11:55,Medium,Dinner fill find offer her rich run style.,60,Saket PS,Clear,Night,Citizen
Theft,Pitampura,2024-03-26,22:04:56,High,Tell which cover once knowledge order this.,48,Pitampura PS,Rainy,Afternoon,Citizen
Theft,Dwarka,2023-12-28,00:56:34,Low,Sport above prepare scene himself indeed gas radio figure personal.,37,Dwarka PS,Cloudy,Morning,Citizen
Theft,Greater Kailash,2024-02-20,07:16:20,Low,Everybody think dinner certainly best nice nice cause.,19,Greater Kailash PS,Rainy,Evening,CCTV
Harassment,Paharganj,2023-12-30,10:55:50,High,Follow cut answer million employee conference road.,46,Paharganj PS,Rainy,Evening,Citizen
Theft,Sarojini Nagar,2024-01-30,07:11:41,High,Reveal analysis fast month east like adult scientist strong effect.,28,Sarojini Nagar PS,Clear,Night,CCTV
Theft,Pitampura,2024-03-12,06:35:55,Medium,Director course girl or.,12,Pitampura PS,Cloudy,Evening,Police
Theft,Paharganj,2023-09-02,15:48:57,Low,Partner fly so sure.,36,Paharganj PS,Clear,Afternoon,CCTV
Harassment,Rohini,2024-07-09,19:02:54,High,Bring wrong change establish feeling fear more.,65,Rohini PS,Rainy,Afternoon,Police
Assault,Khan Market,2023-11-29,15:49:52,Low,Bed final itself bed play senior successful chair vote home imagine.,34,Khan Market PS,Cloudy,Afternoon,Citizen
Stalking,Pitampura,2024-12-19,11:52:03,Medium,Opportunity pass owner wife call those agent someone.,38,Pitampura PS,Rainy,Afternoon,CCTV
Stalking,Greater Kailash,2023-12-19,01:20:46,Medium,New arm professor rise first hit pressure certainly ready property.,60,Greater Kailash PS,Foggy,Afternoon,Citizen
Theft,Karol Bagh,2023-06-16,17:44:46,Medium,Consider result smile task wish require lawyer class plant available.,13,Karol Bagh PS,Clear,Morning,CCTV
Harassment,Pitampura,2023-09-22,15:16:36,Medium,Security health that loss purpose call democratic shake.,58,Pitampura PS,Clear,Afternoon,Police
Assault,Janakpuri,2024-04-08,06:24:03,Medium,Carry six accept still task imagine painting hold.,65,Janakpuri PS,Clear,Night,Citizen
Assault,Khan Market,2024-12-02,03:43:09,Medium,Notice nothing down keep face.,35,Khan Market PS,Clear,Evening,Police
Kidnapping,Saket,2023-08-20,08:50:14,Medium,Federal perform picture day herself yeah.,31,Saket PS,Foggy,Night,Police
Stalking,Okhla,2023-08-20,12:26:38,Low,Share trouble focus fall seven draw clearly set.,69,Okhla PS,Rainy,Morning,Citizen
Theft,Hauz Khas,2023-04-28,20:00:13,Low,Magazine forget election country usually movie so use former picture.,57,Hauz Khas PS,Clear,Morning,Citizen
Harassment,Saket,2023-10-11,12:35:14,Low,Similar give dark list six.,63,Saket PS,Clear,Morning,CCTV
Kidnapping,Connaught Place,2024-08-11,04:14:15,Medium,Model traditional other billion movie leader.,15,Connaught Place PS,Foggy,Afternoon,Citizen
Burglary,Okhla,2024-07-01,10:41:45,Low,Tell choice them cold fear decision he well ok.,15,Okhla PS,Foggy,Evening,CCTV
Assault,Rohini,2023-07-19,21:14:05,Medium,Rich right indeed much until put and program end.,35,Rohini PS,Foggy,Afternoon,Police
Burglary,Karol Bagh,2023-11-17,10:42:51,High,Rich meet foreign say usually sport.,67,Karol Bagh PS,Rainy,Afternoon,Citizen
Burglary,Rohini,2024-01-13,10:07:44,Medium,Unit still catch from thing country.,37,Rohini PS,Cloudy,Morning,Police
Burglary,Dwarka,2023-12-19,13:00:54,High,Control rate garden size fly analysis someone space product area.,44,Dwarka PS,Foggy,Night,Police
Burglary,Chandni Chowk,2025-02-02,14:03:23,Low,Media forget when plan experience see sense never.,70,Chandni Chowk PS,Foggy,Night,Citizen
Stalking,Paharganj,2024-09-21,10:55:52,Medium,Information provide save authority newspaper final employee forget.,27,Paharganj PS,Clear,Evening,Citizen
Kidnapping,Dwarka,2023-03-14,11:55:00,High,Think stop pattern drive similar far address number.,52,Dwarka PS,Rainy,Night,CCTV
Burglary,Saket,2023-08-26,03:44:28,Low,Technology drive whose once interest final change bar.,47,Saket PS,Cloudy,Afternoon,Citizen
Assault,Karol Bagh,2023-07-13,19:00:19,High,Will herself court expect again in consumer.,35,Karol Bagh PS,Rainy,Night,Citizen
Stalking,Pitampura,2023-05-31,21:01:36,Medium,Add professional effect what board recently growth.,39,Pitampura PS,Rainy,Afternoon,Citizen
Theft,Connaught Place,2024-09-08,04:59:28,Medium,Part institution relate report sit later forward prepare show only.,58,Connaught Place PS,Rainy,Evening,Citizen
Theft,Khan Market,2024-12-21,10:57:35,Medium,Yeah one choose structure miss thing most.,36,Khan Market PS,Cloudy,Evening,Citizen
Stalking,Laxmi Nagar,2024-01-27,16:56:17,Low,Traditional require next performance my scientist prove speak get such.,27,Laxmi Nagar PS,Clear,Evening,Police
Kidnapping,Karol Bagh,2024-10-17,05:03:06,High,Center sure provide return class.,16,Karol Bagh PS,Clear,Morning,Citizen
Assault,Laxmi Nagar,2023-06-19,23:37:32,High,Foot performance art under myself lead.,60,Laxmi Nagar PS,Cloudy,Afternoon,CCTV
Assault,Janakpuri,2023-08-06,21:03:07,Low,Message sign article anyone explain skin most cultural.,22,Janakpuri PS,Rainy,Night,Citizen
Burglary,Hauz Khas,2024-02-08,13:23:39,Low,Generation return who speak expert value.,37,Hauz Khas PS,Foggy,Evening,CCTV
Harassment,Hauz Khas,2024-02-26,18:28:24,High,Meet this make field benefit rock television.,13,Hauz Khas PS,Cloudy,Evening,Police
Theft,Okhla,2024-12-03,02:52:32,High,Public control author lot knowledge.,16,Okhla PS,Cloudy,Night,Police
Theft,Chandni Chowk,2024-12-25,13:32:21,Medium,Represent deep cup establish piece whom.,20,Chandni Chowk PS,Rainy,Night,Citizen
Burglary,Saket,2023-02-10,02:25:07,Medium,Break attorney author few official community decision marriage right.,16,Saket PS,Rainy,Evening,Police
Stalking,Ashok Vihar,2023-02-17,18:58:29,Low,Reflect city else view under.,39,Ashok Vihar PS,Rainy,Afternoon,Police
Kidnapping,Laxmi Nagar,2024-10-23,08:46:10,High,Partner say standard affect bring study present accept.,10,Laxmi Nagar PS,Rainy,Afternoon,Police
Stalking,Rajouri Garden,2024-06-17,15:52:41,Medium,Center race hit after idea miss ask everyone provide word learn.,57,Rajouri Garden PS,Rainy,Night,Police
Kidnapping,Rajouri Garden,2023-09-04,09:37:18,Medium,Beat foreign form change remain return language case source born.,66,Rajouri Garden PS,Clear,Afternoon,CCTV
Harassment,Dwarka,2024-11-20,11:23:35,Medium,Product amount start whom action group until alone interview meet.,46,Dwarka PS,Cloudy,Morning,Citizen
Harassment,Vasant Kunj,2025-01-23,16:09:49,High,Market level land compare.,44,Vasant Kunj PS,Foggy,Evening,Citizen
Kidnapping,Rajouri Garden,2024-07-15,14:34:55,Low,From gun the seven lay especially agency power.,18,Rajouri Garden PS,Foggy,Afternoon,Citizen
Harassment,Okhla,2024-12-04,19:04:23,High,Environmental space red in its or government town.,42,Okhla PS,Clear,Night,Citizen
Assault,Karol Bagh,2023-02-26,23:26:11,Medium,Phone everything together nature by can article drop.,48,Karol Bagh PS,Clear,Evening,Citizen
Kidnapping,Laxmi Nagar,2023-04-16,15:36:13,Low,Big position play interesting everything.,20,Laxmi Nagar PS,Rainy,Evening,Police
Theft,Rajouri Garden,2024-12-08,15:21:49,Low,Now suffer serious live concern.,37,Rajouri Garden PS,Rainy,Night,Citizen
Burglary,Hauz Khas,2024-08-14,22:45:55,Low,Anyone clear wide long worker type say he.,36,Hauz Khas PS,Foggy,Afternoon,Citizen
Theft,Hauz Khas,2024-10-01,17:21:07,High,Oil space oil team strong east tax wrong long simply before.,19,Hauz Khas PS,Rainy,Afternoon,CCTV
Theft,Rohini,2023-04-08,21:35:27,Low,Notice go role now factor theory positive someone.,30,Rohini PS,Rainy,Evening,CCTV
Theft,Rohini,2024-10-22,02:48:34,High,My everybody add top wind player woman.,59,Rohini PS,Foggy,Morning,Citizen
Stalking,Rohini,2024-08-23,04:04:36,Medium,Door himself best contain minute.,29,Rohini PS,Foggy,Evening,Citizen
Theft,Pitampura,2023-04-06,02:53:45,Low,Six center article official less follow water happy.,25,Pitampura PS,Clear,Afternoon,Police
Kidnapping,Ashok Vihar,2024-09-07,09:15:59,High,Share director well wait charge floor power those someone fire much.,21,Ashok Vihar PS,Clear,Night,Police
Burglary,Pitampura,2023-05-23,02:52:24,Low,Serious apply throughout once yet country without fine.,26,Pitampura PS,Cloudy,Evening,CCTV
Theft,Ashok Vihar,2024-01-12,02:32:09,High,Tree chance share head speak eight professional fly.,63,Ashok Vihar PS,Cloudy,Evening,CCTV
Harassment,Greater Kailash,2023-08-09,14:25:25,High,Several five training social energy contain address develop statement natural.,32,Greater Kailash PS,Cloudy,Evening,Citizen
Assault,Hauz Khas,2023-04-03,02:03:34,Medium,Care human wait pick spring individual hand debate occur.,57,Hauz Khas PS,Foggy,Morning,Citizen
Burglary,Lajpat Nagar,2023-03-17,16:00:13,Low,Animal turn term career option long might particularly.,55,Lajpat Nagar PS,Cloudy,Afternoon,CCTV
Assault,Chandni Chowk,2023-08-16,10:35:17,High,Mr continue stock share every.,49,Chandni Chowk PS,Foggy,Night,Citizen
Stalking,Laxmi Nagar,2024-09-15,16:21:34,Low,Debate six couple it institution impact.,68,Laxmi Nagar PS,Rainy,Night,Police
Stalking,Paharganj,2023-11-10,02:21:47,Medium,The law wall deep.,51,Paharganj PS,Clear,Night,Citizen
Theft,Paharganj,2024-04-04,06:10:33,Low,Page direction ready pick girl young bill food everybody.,62,Paharganj PS,Rainy,Morning,Citizen
Stalking,Mayur Vihar,2023-10-03,23:53:55,Low,Be nearly other how security new law civil natural second chair.,23,Mayur Vihar PS,Rainy,Night,Citizen
Assault,Rajouri Garden,2024-10-23,07:56:33,Medium,Financial thing price sometimes he family office.,21,Rajouri Garden PS,Rainy,Morning,Citizen
Assault,Ashok Vihar,2024-02-13,10:18:05,Medium,North to own husband hair.,14,Ashok Vihar PS,Clear,Morning,CCTV
Harassment,Greater Kailash,2024-04-12,03:13:53,High,Interest note some response floor two.,62,Greater Kailash PS,Cloudy,Morning,Police
Kidnapping,Rohini,2024-05-07,04:05:31,Medium,Too one series million experience perhaps message down.,32,Rohini PS,Clear,Night,Citizen
Theft,Chandni Chowk,2023-12-08,20:16:19,Medium,Improve up cut ask focus clearly our history the however.,58,Chandni Chowk PS,Rainy,Afternoon,Citizen
Burglary,Okhla,2023-08-03,23:19:42,Medium,Shake do somebody pass gun owner morning.,11,Okhla PS,Rainy,Afternoon,Citizen
Stalking,Vasant Kunj,2024-10-12,01:04:35,Low,Work exactly who price however he.,26,Vasant Kunj PS,Cloudy,Afternoon,Police
Burglary,Rohini,2023-10-31,04:05:23,Medium,Budget him strategy he good million.,58,Rohini PS,Rainy,Morning,Police
Assault,Rohini,2024-05-30,12:15:21,Low,Military possible maintain miss tell sort family music.,39,Rohini PS,Foggy,Afternoon,Police
Assault,Vasant Kunj,2023-10-29,18:45:52,Medium,Difficult perform successful art concern relationship finish Mr free.,17,Vasant Kunj PS,Rainy,Evening,Citizen
Stalking,Rajouri Garden,2023-03-12,18:59:42,Low,Condition its present policy out show none represent thousand join.,62,Rajouri Garden PS,Rainy,Night,Citizen
Burglary,Khan Market,2024-11-17,08:14:36,Medium,Near risk hear in speech kitchen song ago.,33,Khan Market PS,Clear,Night,CCTV
Theft,Chandni Chowk,2023-09-17,12:23:48,High,Question for probably other decision.,16,Chandni Chowk PS,Rainy,Night,Citizen
Stalking,Khan Market,2024-01-10,22:47:16,Low,Team expert his serious choice would agent anything quality identify.,23,Khan Market PS,Clear,Night,Police
Theft,Hauz Khas,2024-09-18,21:43:25,High,Way sometimes news thought say sign season price prepare.,45,Hauz Khas PS,Clear,Afternoon,Citizen
Burglary,Connaught Place,2024-03-14,00:22:26,Low,Improve receive behavior method.,26,Connaught Place PS,Rainy,Morning,CCTV
Assault,Hauz Khas,2024-01-11,22:24:21,Low,Space relate person past religious together room second recently reduce.,67,Hauz Khas PS,Cloudy,Evening,Citizen
Kidnapping,Rajouri Garden,2024-06-07,08:09:07,High,Quite fall will yourself able billion manager consider.,36,Rajouri Garden PS,Clear,Night,CCTV
Stalking,Hauz Khas,2023-11-26,13:27:05,Low,National easy travel alone analysis ball.,37,Hauz Khas PS,Cloudy,Morning,Police
Theft,Khan Market,2023-03-30,04:32:07,Low,Black house first process cell significant.,61,Khan Market PS,Rainy,Evening,CCTV
Theft,Saket,2024-11-11,04:07:38,High,Owner within cut explain perform court party arm future identify.,32,Saket PS,Foggy,Evening,CCTV
Kidnapping,Janakpuri,2024-11-22,14:09:22,High,Window third decision deep government believe how.,24,Janakpuri PS,Foggy,Morning,Citizen
Harassment,Khan Market,2024-10-10,22:07:42,High,Product interview experience society relationship drive material central short save.,33,Khan Market PS,Foggy,Evening,Citizen
Stalking,Rohini,2023-09-26,10:39:13,Low,Management member yet customer cause vote born explain through want stage.,67,Rohini PS,Cloudy,Night,Police
Assault,Lajpat Nagar,2024-03-21,02:49:57,High,On total listen rather he special.,11,Lajpat Nagar PS,Cloudy,Morning,CCTV
Harassment,Khan Market,2023-07-27,21:27:28,Low,Grow plan central it different why difference eye maybe against.,43,Khan Market PS,Rainy,Afternoon,Police
Stalking,Janakpuri,2025-01-29,23:07:26,High,Performance seat improve your try.,29,Janakpuri PS,Rainy,Evening,Police
Kidnapping,Chandni Chowk,2025-02-03,06:15:28,Medium,Force offer president bit parent minute day sound take pay.,45,Chandni Chowk PS,Cloudy,Morning,Citizen
Kidnapping,Janakpuri,2024-08-09,23:38:12,Medium,Million to they size now military grow arrive far.,65,Janakpuri PS,Rainy,Morning,Police
Burglary,Janakpuri,2023-09-02,07:16:22,Medium,Establish goal role stuff and law ability.,44,Janakpuri PS,Cloudy,Evening,Police
Assault,Rajouri Garden,2024-08-06,15:10:00,Medium,Pull still ground me hand company push.,18,Rajouri Garden PS,Rainy,Evening,CCTV
Assault,Ashok Vihar,2023-09-30,13:30:20,High,Plant road stand already open draw.,56,Ashok Vihar PS,Cloudy,Morning,Citizen
Harassment,Lajpat Nagar,2023-09-25,20:40:11,Medium,Door parent language somebody respond book discuss term speech.,55,Lajpat Nagar PS,Cloudy,Morning,CCTV
Theft,Okhla,2024-03-05,20:02:18,Low,Generation summer herself left wall resource different.,10,Okhla PS,Clear,Morning,Police
Burglary,Khan Market,2023-10-13,06:35:35,High,Watch we laugh next production.,60,Khan Market PS,Foggy,Afternoon,Police
Harassment,Saket,2023-12-21,21:08:22,Medium,Though listen light dark house point.,21,Saket PS,Cloudy,Night,Police
Stalking,Greater Kailash,2024-01-17,13:32:48,Low,Stand late today my ground line increase.,42,Greater Kailash PS,Foggy,Afternoon,Citizen
Harassment,Saket,2024-12-24,17:53:58,Low,Itself success include imagine fight yourself.,31,Saket PS,Cloudy,Afternoon,Police
Burglary,Chandni Chowk,2023-07-16,16:12:07,Low,Dream against plant back by hot boy similar.,67,Chandni Chowk PS,Cloudy,Afternoon,Police
Assault,Laxmi Nagar,2024-11-30,02:00:44,Low,Perform bit relationship go role seem suggest card station everybody must.,46,Laxmi Nagar PS,Rainy,Night,Citizen
Assault,Rohini,2023-05-03,10:30:38,Medium,Own next give final seek top budget itself I pattern.,21,Rohini PS,Clear,Morning,CCTV
Stalking,Rohini,2023-03-29,00:16:21,Medium,Mother even method without him society media.,34,Rohini PS,Rainy,Evening,CCTV
Theft,Chandni Chowk,2024-11-23,20:28:37,Low,Pressure what speak drug defense kitchen newspaper.,54,Chandni Chowk PS,Rainy,Evening,Police
Kidnapping,Paharganj,2025-02-01,14:03:30,Medium,You capital economy that party point maybe.,48,Paharganj PS,Cloudy,Night,CCTV
Assault,Paharganj,2024-05-05,13:51:39,Low,Ground center discover agree born.,70,Paharganj PS,Rainy,Afternoon,CCTV
Theft,Dwarka,2023-11-15,13:14:43,Low,Read arm including maybe similar certain region.,33,Dwarka PS,Cloudy,Night,CCTV
Assault,Pitampura,2024-12-26,04:12:02,High,Role sing others head seat down around amount involve great.,15,Pitampura PS,Cloudy,Evening,Police
Burglary,Ashok Vihar,2023-05-29,02:38:01,High,Base fast worry yourself deal international station talk arm.,46,Ashok Vihar PS,Foggy,Morning,Citizen
Assault,Lajpat Nagar,2023-11-27,07:31:35,High,Its break work fine city history ahead stop activity fight.,45,Lajpat Nagar PS,Cloudy,Morning,CCTV
Kidnapping,Ashok Vihar,2024-11-08,11:24:34,Medium,Summer at military example stock key really exactly organization word particular.,13,Ashok Vihar PS,Rainy,Night,CCTV
Theft,Connaught Place,2023-10-31,22:00:53,High,Language own debate positive.,48,Connaught Place PS,Clear,Evening,CCTV
Stalking,Chandni Chowk,2023-02-07,20:39:46,High,Stay game former send around.,12,Chandni Chowk PS,Rainy,Evening,CCTV
Harassment,Paharganj,2023-04-03,00:33:54,Low,Bad option over late court relate yeah us.,37,Paharganj PS,Foggy,Morning,Police
Burglary,Mayur Vihar,2024-12-11,06:23:50,Medium,Action report back hair without meet with age amount must grow.,33,Mayur Vihar PS,Clear,Night,Citizen
Assault,Khan Market,2023-03-02,14:47:54,High,Lot Democrat skill action prevent worker rate book current benefit.,29,Khan Market PS,Foggy,Night,Citizen
Assault,Janakpuri,2023-03-18,01:04:27,Medium,Become last around different serve.,32,Janakpuri PS,Clear,Morning,CCTV
Assault,Chandni Chowk,2024-05-02,17:25:39,Medium,Camera because line church receive consider where pick whom picture.,41,Chandni Chowk PS,Cloudy,Evening,CCTV
Burglary,Khan Market,2023-03-03,05:52:24,Low,Law nation six tell type bad.,15,Khan Market PS,Cloudy,Evening,Citizen
Burglary,Lajpat Nagar,2024-08-10,22:24:11,Low,Many often member mention threat himself wish.,28,Lajpat Nagar PS,Clear,Morning,Citizen
Burglary,Ashok Vihar,2023-12-05,16:10:02,High,Future me I type sense know whatever.,30,Ashok Vihar PS,Rainy,Night,Police
Harassment,Mayur Vihar,2024-08-02,16:46:11,Medium,Physical college action bit.,29,Mayur Vihar PS,Foggy,Night,CCTV
Kidnapping,Ashok Vihar,2024-04-06,06:30:03,Medium,Collection behind cultural coach reflect my idea sister time.,52,Ashok Vihar PS,Cloudy,Afternoon,Citizen
Assault,Pitampura,2023-04-23,00:07:04,Low,On economy himself school customer role option.,68,Pitampura PS,Clear,Evening,CCTV
Harassment,Saket,2024-01-30,20:22:43,Medium,Adult control test measure something heavy never create some only.,31,Saket PS,Rainy,Morning,Police
Harassment,Laxmi Nagar,2023-09-27,03:44:24,High,Choose forward organization such heavy property analysis create answer quite home.,66,Laxmi Nagar PS,Cloudy,Evening,Police
Stalking,Pitampura,2023-04-28,16:56:14,Medium,Consumer know American peace ask.,50,Pitampura PS,Foggy,Afternoon,CCTV
Harassment,Lajpat Nagar,2023-08-16,09:57:01,Low,Bank compare old fine share compare blood.,33,Lajpat Nagar PS,Rainy,Evening,CCTV
Kidnapping,Hauz Khas,2023-07-30,01:20:08,High,Paper ago worry most himself clearly I method direction.,69,Hauz Khas PS,Cloudy,Morning,CCTV
Stalking,Hauz Khas,2024-03-30,21:37:21,Low,By after let heart head west must.,36,Hauz Khas PS,Rainy,Evening,Citizen
Harassment,Paharganj,2024-09-23,00:25:04,Low,East staff model white discussion food soon cold player great sometimes.,61,Paharganj PS,Rainy,Night,Police
Theft,Janakpuri,2023-10-23,17:52:28,High,Not positive argue name.,44,Janakpuri PS,Rainy,Evening,Police
Kidnapping,Hauz Khas,2024-07-15,20:42:31,High,Blood piece sometimes PM this offer real discussion nothing.,51,Hauz Khas PS,Rainy,Afternoon,Citizen
Kidnapping,Pitampura,2024-02-27,22:33:00,Medium,Professional investment every camera community law out reveal scene.,12,Pitampura PS,Cloudy,Afternoon,Citizen
Burglary,Janakpuri,2024-10-03,15:13:03,Medium,Data debate second across product put product yes page.,45,Janakpuri PS,Clear,Morning,CCTV
Harassment,Vasant Kunj,2023-10-04,05:36:31,Low,Hear smile hard deal consider.,47,Vasant Kunj PS,Cloudy,Evening,CCTV
Harassment,Laxmi Nagar,2023-12-26,06:03:07,Medium,She place onto party create bed.,26,Laxmi Nagar PS,Cloudy,Afternoon,Citizen
Stalking,Greater Kailash,2023-08-04,19:23:17,High,Force issue own response per west structure.,37,Greater Kailash PS,Cloudy,Morning,Citizen
Stalking,Rohini,2023-07-09,23:35:02,Low,Open garden foreign president actually education language letter market probably candidate.,58,Rohini PS,Rainy,Evening,CCTV
Burglary,Karol Bagh,2023-06-17,16:37:58,High,Note life right offer level college himself spend particularly.,51,Karol Bagh PS,Foggy,Evening,Police
Kidnapping,Okhla,2023-11-28,18:39:49,High,Want north consider partner.,29,Okhla PS,Foggy,Morning,Police
Burglary,Ashok Vihar,2024-09-21,19:34:46,Low,Too country box big impact some.,48,Ashok Vihar PS,Cloudy,Night,Police
Assault,Greater Kailash,2024-03-16,04:06:50,High,Whether truth thought far card.,26,Greater Kailash PS,Rainy,Evening,CCTV
Harassment,Laxmi Nagar,2023-02-18,15:26:35,Low,Room figure lay go letter off behind.,69,Laxmi Nagar PS,Foggy,Night,Citizen
Kidnapping,Janakpuri,2023-11-16,16:57:30,Medium,Hospital when also appear law enough everything agree.,37,Janakpuri PS,Rainy,Morning,Citizen
Stalking,Mayur Vihar,2023-09-04,12:05:55,Medium,Among create reduce around trouble organization others open heavy little recently.,62,Mayur Vihar PS,Clear,Evening,Citizen
Stalking,Karol Bagh,2023-05-18,21:10:42,Low,Next determine fast so parent.,40,Karol Bagh PS,Cloudy,Afternoon,Citizen
Harassment,Lajpat Nagar,2024-04-15,11:15:31,High,First friend education end group.,32,Lajpat Nagar PS,Rainy,Afternoon,CCTV
Assault,Janakpuri,2023-03-19,05:53:05,Medium,Offer rich scientist down able tonight recent thing.,20,Janakpuri PS,Rainy,Night,Police
Stalking,Connaught Place,2024-11-21,01:17:11,Low,Its after once fire church ask perform who.,33,Connaught Place PS,Cloudy,Night,Police
Stalking,Janakpuri,2023-06-20,05:35:18,Medium,Wrong whom they sort until state few meet.,66,Janakpuri PS,Foggy,Night,CCTV
Theft,Karol Bagh,2023-10-02,15:15:26,Medium,Black operation authority threat smile discuss choice public affect.,32,Karol Bagh PS,Clear,Morning,Citizen
Burglary,Pitampura,2023-12-04,21:27:26,High,Particular personal animal test which.,32,Pitampura PS,Clear,Night,Police
Harassment,Connaught Place,2024-08-18,19:04:22,Low,Commercial question here music show mention customer.,51,Connaught Place PS,Foggy,Morning,Police
Stalking,Dwarka,2024-06-24,02:58:21,High,Former represent my least region consumer rich.,65,Dwarka PS,Foggy,Afternoon,CCTV
Burglary,Pitampura,2023-12-07,06:36:04,High,Impact safe term staff trip watch east always collection.,17,Pitampura PS,Rainy,Afternoon,Citizen
Stalking,Karol Bagh,2024-08-17,07:23:18,High,Foot after system our history former soldier condition.,61,Karol Bagh PS,Clear,Morning,CCTV
Assault,Lajpat Nagar,2025-01-15,20:37:50,High,Economic wind room reason fast.,25,Lajpat Nagar PS,Foggy,Evening,Citizen
Assault,Khan Market,2023-05-14,13:51:34,Medium,Really might else these color instead anyone.,10,Khan Market PS,Cloudy,Evening,Police
Harassment,Rajouri Garden,2024-02-21,13:00:55,Medium,Cup bill relate big idea science word without.,62,Rajouri Garden PS,Cloudy,Morning,CCTV
Kidnapping,Paharganj,2024-05-06,16:20:20,High,Letter billion discover per treat beautiful both coach through.,25,Paharganj PS,Rainy,Evening,CCTV
